{
  "case_id": "scenario_structured_conflicting_source_not_produce",
  "input": {
    "input_type": "dataset_row",
    "raw_input": {"dataset": "wapo_uof", "subject_name": "John Example"},
    "known_fields": {
      "defendant_names": ["John Example"],
      "subject_name": "John Example",
      "agency": "Phoenix Police Department",
      "jurisdiction": {"city": "Phoenix", "county": null, "state": "AZ"},
      "incident_date": "2022-05-12",
      "incident_type": "police shooting"
    },
    "missing_fields": [],
    "candidate_queries": ["\"John Example\" Arizona police shooting 2022"]
  },
  "case_identity": {
    "defendant_names": ["John Example"],
    "victim_names": [],
    "agency": "Phoenix Police Department",
    "jurisdiction": {"city": "Phoenix", "county": null, "state": "AZ"},
    "incident_date": "2022-05-12",
    "case_numbers": ["CR-2022-1001"],
    "charges": ["aggravated assault"],
    "outcome_status": "sentenced",
    "identity_confidence": "high",
    "identity_anchors": ["full_name", "city", "agency", "incident_date", "case_number", "source_authority"]
  },
  "sources": [
    {
      "source_id": "conflicting_court_source",
      "url": "https://www.courtlistener.com/docket/conflict",
      "title": "John Example Florida docket",
      "snippet": "John Example was sentenced in Miami, Florida.",
      "raw_text": "John Example was sentenced in Miami, Florida, not Phoenix, Arizona.",
      "source_type": "court_docket",
      "source_roles": ["identity_source", "outcome_source"],
      "source_authority": "court",
      "api_name": "courtlistener",
      "discovered_via": "fixture",
      "retrieved_at": "2026-04-30T00:00:00Z",
      "case_input_id": "structured_conflict",
      "metadata": {"fixture": true},
      "cost_estimate": 0.0,
      "confidence_signals": {},
      "matched_case_fields": ["defendant_full_name"]
    }
  ],
  "artifact_claims": [],
  "verified_artifacts": [
    {
      "artifact_id": "structured_conflict_bodycam_001",
      "artifact_type": "bodycam",
      "artifact_url": "https://cdn.muckrock.com/foia_files/structured_conflict_bodycam.mp4",
      "source_url": "https://www.muckrock.com/foi/phoenix-100/bodycam-conflict/",
      "source_authority": "foia",
      "downloadable": true,
      "format": "video",
      "matched_case_fields": ["defendant_full_name"],
      "confidence": 0.72,
      "verification_method": "file_extension",
      "risk_flags": [],
      "metadata": {"fixture": true}
    }
  ],
  "scores": {"identity_score": 0.0, "outcome_score": 0.0, "artifact_score": 0.0, "actionability_score": 0.0},
  "verdict": "HOLD",
  "next_actions": ["Resolve conflicting structured/court location before production."],
  "risk_flags": ["conflicting_jurisdiction"]
}
